{
  "submission_id": "sub-1",
  "checks": [
    {
      "kind": "SCHEMA",
      "result": "PASS"
    }
  ],
  "comparisons": [
    {
      "role": "LORA_A",
      "name": "m",
      "group": "SAFETY",
      "candidate": 0.9,
      "candidate_n": 10,
      "higher_is_better": true
    }
  ],
  "subject": {},
  "notes": [
    "n"
  ],
  "active_release_id": null
}
